PubmedID,Title,Publication Date,Non-academic Author(s),Company Affiliation(s),Corresponding Author Email
40653126,"Race and neighborhood social determinants of premature cancer mortality in California adults, 2015-2021.",2025,Neil A Maizlish; Adrienne Damicis; Tracy Delaney; Helen Dowling,Public Health Alliance of Southern California. Electronic address: NMaizlish@phi.org.; Public Health Alliance of Southern California.; Public Health Alliance of Southern California.; Public Health Alliance of Southern California.,NMaizlish@phi.org.
40652684,SARS-CoV-2 vaccine failure rates and predictors of immune response in a diverse immunocompromised patient population.,2025,Kaniel Cassady; Erica Chio; Andrea T Hooper; Matthew F Wipperman,"Global Development Regeneron Pharmaceuticals, Inc., Tarrytown, NY, USA.; Global Development Regeneron Pharmaceuticals, Inc., Tarrytown, NY, USA.; Global Development Regeneron Pharmaceuticals, Inc., Tarrytown, NY, USA.; Global Development Regeneron Pharmaceuticals, Inc., Tarrytown, NY, USA.",Benjamin.greenberg@utsouthwestern.edu.
40652567,Effects of the COVID-19 pandemic and 'Find Cancer Early' campaign on cancer symptom knowledge in regional Western Australia.,2025,Cassandra Clayforth; Hussam Al-Hakimi; Melissa Ledger,"Cancer Council Western Australia, Bagot Road, Subiaco, WA 6008, Australia.; Cancer Council Western Australia, Bagot Road, Subiaco, WA 6008, Australia.; Cancer Council Western Australia, Bagot Road, Subiaco, WA 6008, Australia.",
40651844,Effectiveness of full mRNA vaccinations to prevent COVID-19 among immunocompromised patients receiving tixagevimab-cilgavimab as pre-exposure prophylaxis-authors' response.,2025,,,changsc@ntu.edu.tw.
40651609,"Geography, Genes, and Germs: An Evolutionary Entanglement.",2025,,,
40650450,Synthesis of Perfluorooctyl-Functionalized Halloysite Nanotubes for Dispersive Solid-Phase Extraction of Antimalarial Inhibitors in Whole Blood.,2025,,,
40650276,NK Cells: A Powerful Squad Versus SARS-CoV-2.,2025,,,
40649394,Synthesis of Novel Tetra-Substituted Pyrazole Derivatives Using Microwave Irradiation and Their Anti-Leukemic Activity Against Jurkat Cells.,2025,,,
40648596,Long COVID Patients' Perceptions of Social Support in Their Work and Personal Lives: A Qualitative Study.,2025,,,
40648557,Perceptions of Rehabilitation Access After SARS-CoV-2 Infection in Romanian Patients with Chronic Diseases: A Mixed-Methods Exploratory Study.,2025,,,
40648544,Telehealth Use Among Medicaid-Enrolled Children with Sickle Cell Disease Before and During the COVID-19 Pandemic.,2025,,,
40647661,Inverse Association of Longitudinal Variations in Fat Tissue Radiodensity and Area.,2025,Giulia Besutti; Marta Ottone; Francesco Farioli; Pierpaolo Pattacini; Paolo Giorgi Rossi,"Radiology Unit, Azienda USL-IRCSS di Reggio Emilia, 42123 Reggio Emilia, Italy.; Epidemiology Unit, Azienda USL-IRCSS di Reggio Emilia, 42123 Reggio Emilia, Italy.; Radiology Unit, Azienda USL-IRCSS di Reggio Emilia, 42123 Reggio Emilia, Italy.; Radiology Unit, Azienda USL-IRCSS di Reggio Emilia, 42123 Reggio Emilia, Italy.; Epidemiology Unit, Azienda USL-IRCSS di Reggio Emilia, 42123 Reggio Emilia, Italy.",
40647518,A Histopathological and Surgical Analysis of Gastric Cancer: A Two-Year Experience in a Single Center.,2025,,,
40647450,Changes in the Characteristics of Kidney Cancer Detection During the COVID-19 Pandemic.,2025,,,
40647079,"Reforming Food, Drug, and Nutraceutical Regulations to Improve Public Health and Reduce Healthcare Costs.",2025,,,
40646464,The SARS-CoV-2 envelope PDZ binding motif acts as a virulence factor disrupting host's epithelial cell-cell junctions.,2025,Flavio Alvarez; Guilherme Dias de Melo; Florence Larrous; Lauriane Kergoat; Batiste Boëda; Vincent Michel; Danielle Seilhean; Magali Tichit; David Hing; David Hardy; Etienne Kornobis; Hervé Bourhy; Nicolas Wolff; Célia Caillet-Saguy,"Institut Pasteur, Signaling and Receptors Dynamics Unit, Université Paris Cité, 75015, Paris, France. flavio.alvarez@pasteur.fr.; Institut Pasteur, Lyssavirus Epidemiology and Neuropathology Unit, Université Paris Cité, 75015, Paris, France.; Institut Pasteur, Lyssavirus Epidemiology and Neuropathology Unit, Université Paris Cité, 75015, Paris, France.; Institut Pasteur, Lyssavirus Epidemiology and Neuropathology Unit, Université Paris Cité, 75015, Paris, France.; Institut Pasteur, Cell Polarity Migration and Cancer Unit, 75015, Paris, France.; Institut Pasteur, Pathogenesis of Vascular Infections Unit, Université Paris Cité, 75015, Paris, France.; AP-HP, Hôpital Pitié-Salpêtrière, Département de Neuropathologie, Sorbonne Université, Paris, France.; Institut Pasteur, Université Paris Cité, Histopathology Platform, 75015, Paris, France.; Institut Pasteur, Université Paris Cité, Histopathology Platform, 75015, Paris, France.; Institut Pasteur, Université Paris Cité, Histopathology Platform, 75015, Paris, France.; Institut Pasteur, Université Paris Cité, Biomics C2RT, 75015, Paris, France.; Institut Pasteur, Lyssavirus Epidemiology and Neuropathology Unit, Université Paris Cité, 75015, Paris, France.; Institut Pasteur, Signaling and Receptors Dynamics Unit, Université Paris Cité, 75015, Paris, France.; Institut Pasteur, Humoral Immunology Unit, Université Paris Cité, 75015, Paris, France.",flavio.alvarez@pasteur.fr.
40645640,Sequence-similarity-based approach to SARS-CoV-2 genome sequence and lung cancer-related genes via multivariate feature extraction method.,2025,Halil Ibrahim Cakar,"LabECAM, ECAM LaSalle Site de Lyon, Université Lyon, 40 montée St Barthelemy, Lyon, France.",
40644699,Identifying People Living With or Those at Risk for HIV in a Nationally Sampled Electronic Health Record Repository Called the National Clinical Cohort Collaborative: Computational Phenotyping Study.,2025,Vithal Madhira; ,"Palila Software, Reno, NV, United States.; See Acknowledgments, .",
40644438,Performance and feasibility of self-microsampling of capillary blood and saliva for serological testing of SARS-CoV-2.,2025,,,
40643400,Assessing the Rate and Quality of Breast Cancer Treatment Following Initial Diagnosis.,2025,Natalie Stratemeier,Radiology.,
